timestamp	run_id	commit	score	status	passes_gates	symbol	timeframe	start	end	wfo_return_pct	wfo_mean_sharpe	max_drawdown_pct	bootstrap_p_loss_pct	profit_concentration_pct	total_trades	description
2026-06-12T22:41:50.867816+00:00	20260612-224139-012084-cd27f6	3699fcf	-486.532593	discard	false	SOLUSDT	1h	2024-01-09T07:00:00+00:00	2026-02-23T19:00:00+00:00	-34.30	-0.73	56.71	87.60	49.70	134	dislocation_event_rolling_entry: dislocation-event-rolling-entry metric=premium_spread tail=5 horizon=24
2026-06-12T22:42:03.884283+00:00	20260612-224151-130707-935b95	3699fcf	-704.609833	discard	false	SOLUSDT	1h	2024-01-09T07:00:00+00:00	2026-02-23T19:00:00+00:00	-54.78	-1.50	78.59	99.20	67.13	195	dislocation_event_rolling_entry: dislocation-event-rolling-entry metric=premium_spread tail=10 horizon=24
2026-06-12T22:42:15.887916+00:00	20260612-224204-205496-e0ff31	3699fcf	-586.677630	discard	false	SOLUSDT	1h	2024-01-09T07:00:00+00:00	2026-02-23T19:00:00+00:00	-38.46	-0.93	64.14	96.00	64.43	182	dislocation_event_rolling_entry: dislocation-event-rolling-entry metric=basis_spread tail=5 horizon=12
2026-06-12T22:42:28.628243+00:00	20260612-224216-516102-c2fced	3699fcf	-486.532593	discard	false	SOLUSDT	1h	2024-01-09T07:00:00+00:00	2026-02-23T19:00:00+00:00	-34.30	-0.73	56.71	87.60	49.70	134	dislocation_event_rolling_entry: dislocation-event-rolling-entry metric=premium_spread tail=5 horizon=24
2026-06-12T22:42:40.607358+00:00	20260612-224228-977167-5dc9e6	3699fcf	-379.302989	discard	false	SOLUSDT	1h	2024-01-09T07:00:00+00:00	2026-02-23T19:00:00+00:00	-15.30	-0.19	45.79	67.00	70.90	144	dislocation_event_rolling_entry: dislocation-event-rolling-entry metric=basis_spread tail=5 horizon=24
2026-06-12T22:42:52.458129+00:00	20260612-224240-846866-00fe1f	3699fcf	-379.302989	discard	false	SOLUSDT	1h	2024-01-09T07:00:00+00:00	2026-02-23T19:00:00+00:00	-15.30	-0.19	45.79	67.00	70.90	144	dislocation_event_rolling_entry: dislocation-event-rolling-entry metric=basis_spread tail=5 horizon=24
2026-06-12T22:43:04.406063+00:00	20260612-224252-793085-1a52c9	3699fcf	-620.214068	discard	false	SOLUSDT	1h	2024-01-09T07:00:00+00:00	2026-02-23T19:00:00+00:00	-34.38	-0.61	58.68	96.60	100.00	178	dislocation_event_rolling_entry: dislocation-event-rolling-entry metric=premium_spread tail=5 horizon=12
2026-06-12T22:43:16.123210+00:00	20260612-224304-675509-260ba9	3699fcf	-586.677630	discard	false	SOLUSDT	1h	2024-01-09T07:00:00+00:00	2026-02-23T19:00:00+00:00	-38.46	-0.93	64.14	96.00	64.43	182	dislocation_event_rolling_entry: dislocation-event-rolling-entry metric=basis_spread tail=5 horizon=12
2026-06-12T22:43:27.902865+00:00	20260612-224316-523977-b77b70	3699fcf	-385.016521	discard	false	SOLUSDT	1h	2024-01-09T07:00:00+00:00	2026-02-23T19:00:00+00:00	-15.30	-0.19	46.46	67.80	70.90	144	dislocation_event_rolling_entry: dislocation-event-rolling-entry metric=basis_spread tail=5 horizon=24
2026-06-12T22:43:39.608167+00:00	20260612-224328-148525-4260da	3699fcf	-715.484282	discard	false	SOLUSDT	1h	2024-01-09T07:00:00+00:00	2026-02-23T19:00:00+00:00	-49.29	-1.46	77.30	99.00	79.37	289	dislocation_event_rolling_entry: dislocation-event-rolling-entry metric=premium_spread tail=10 horizon=12
2026-06-12T22:43:51.396775+00:00	20260612-224339-969356-d5b540	3699fcf	-716.253750	discard	false	SOLUSDT	1h	2024-01-09T07:00:00+00:00	2026-02-23T19:00:00+00:00	-49.03	-1.45	77.30	99.00	80.00	289	dislocation_event_rolling_entry: dislocation-event-rolling-entry metric=premium_spread tail=10 horizon=12
2026-06-12T22:44:03.221892+00:00	20260612-224351-606447-c4e99a	3699fcf	-586.677630	discard	false	SOLUSDT	1h	2024-01-09T07:00:00+00:00	2026-02-23T19:00:00+00:00	-38.46	-0.93	64.14	96.00	64.43	182	dislocation_event_rolling_entry: dislocation-event-rolling-entry metric=basis_spread tail=5 horizon=12
2026-06-12T22:44:14.639270+00:00	20260612-224403-422104-6f4344	3699fcf	-704.609833	discard	false	SOLUSDT	1h	2024-01-09T07:00:00+00:00	2026-02-23T19:00:00+00:00	-54.78	-1.50	78.59	99.20	67.13	195	dislocation_event_rolling_entry: dislocation-event-rolling-entry metric=premium_spread tail=10 horizon=24
2026-06-12T22:44:26.173185+00:00	20260612-224414-902467-c8cb6d	3699fcf	-620.214068	discard	false	SOLUSDT	1h	2024-01-09T07:00:00+00:00	2026-02-23T19:00:00+00:00	-34.38	-0.61	58.68	96.60	100.00	178	dislocation_event_rolling_entry: dislocation-event-rolling-entry metric=premium_spread tail=5 horizon=12
2026-06-12T22:44:37.588909+00:00	20260612-224426-391572-d25aef	3699fcf	-586.677630	discard	false	SOLUSDT	1h	2024-01-09T07:00:00+00:00	2026-02-23T19:00:00+00:00	-38.46	-0.93	64.14	96.00	64.43	182	dislocation_event_rolling_entry: dislocation-event-rolling-entry metric=basis_spread tail=5 horizon=12
2026-06-12T22:44:49.080225+00:00	20260612-224437-772654-bc6a2e	3699fcf	-371.815041	discard	false	SOLUSDT	1h	2024-01-09T07:00:00+00:00	2026-02-23T19:00:00+00:00	-14.20	-0.16	45.09	65.00	72.81	144	dislocation_event_rolling_entry: dislocation-event-rolling-entry metric=basis_spread tail=5 horizon=24
2026-06-12T22:45:00.442839+00:00	20260612-224449-284521-fdd8dc	3699fcf	-371.815041	discard	false	SOLUSDT	1h	2024-01-09T07:00:00+00:00	2026-02-23T19:00:00+00:00	-14.20	-0.16	45.09	65.00	72.81	144	dislocation_event_rolling_entry: dislocation-event-rolling-entry metric=basis_spread tail=5 horizon=24
2026-06-12T22:45:12.028336+00:00	20260612-224500-671895-20bdc8	3699fcf	-588.869786	discard	false	SOLUSDT	1h	2024-01-09T07:00:00+00:00	2026-02-23T19:00:00+00:00	-38.46	-0.93	64.58	96.00	64.43	182	dislocation_event_rolling_entry: dislocation-event-rolling-entry metric=basis_spread tail=5 horizon=12
2026-06-12T22:45:23.481850+00:00	20260612-224512-236629-37e4dd	3699fcf	-586.677630	discard	false	SOLUSDT	1h	2024-01-09T07:00:00+00:00	2026-02-23T19:00:00+00:00	-38.46	-0.93	64.14	96.00	64.43	182	dislocation_event_rolling_entry: dislocation-event-rolling-entry metric=basis_spread tail=5 horizon=12
2026-06-12T22:45:34.585145+00:00	20260612-224523-665477-15565b	3699fcf	-486.532593	discard	false	SOLUSDT	1h	2024-01-09T07:00:00+00:00	2026-02-23T19:00:00+00:00	-34.30	-0.73	56.71	87.60	49.70	134	dislocation_event_rolling_entry: dislocation-event-rolling-entry metric=premium_spread tail=5 horizon=24
2026-06-12T22:45:45.760816+00:00	20260612-224534-763837-72b528	3699fcf	-715.484282	discard	false	SOLUSDT	1h	2024-01-09T07:00:00+00:00	2026-02-23T19:00:00+00:00	-49.29	-1.46	77.30	99.00	79.37	289	dislocation_event_rolling_entry: dislocation-event-rolling-entry metric=premium_spread tail=10 horizon=12
2026-06-12T22:45:56.792068+00:00	20260612-224545-964615-9e19bf	3699fcf	-715.484282	discard	false	SOLUSDT	1h	2024-01-09T07:00:00+00:00	2026-02-23T19:00:00+00:00	-49.29	-1.46	77.30	99.00	79.37	289	dislocation_event_rolling_entry: dislocation-event-rolling-entry metric=premium_spread tail=10 horizon=12
2026-06-12T22:46:07.989832+00:00	20260612-224556-989281-d2f148	3699fcf	-704.602769	discard	false	SOLUSDT	1h	2024-01-09T07:00:00+00:00	2026-02-23T19:00:00+00:00	-53.84	-1.47	78.13	98.80	69.79	195	dislocation_event_rolling_entry: dislocation-event-rolling-entry metric=premium_spread tail=10 horizon=24
2026-06-12T22:46:19.288750+00:00	20260612-224608-203967-dae19d	3699fcf	-371.815041	discard	false	SOLUSDT	1h	2024-01-09T07:00:00+00:00	2026-02-23T19:00:00+00:00	-14.20	-0.16	45.09	65.00	72.81	144	dislocation_event_rolling_entry: dislocation-event-rolling-entry metric=basis_spread tail=5 horizon=24
2026-06-12T22:46:30.543360+00:00	20260612-224619-494115-df8da9	3699fcf	-371.815041	discard	false	SOLUSDT	1h	2024-01-09T07:00:00+00:00	2026-02-23T19:00:00+00:00	-14.20	-0.16	45.09	65.00	72.81	144	dislocation_event_rolling_entry: dislocation-event-rolling-entry metric=basis_spread tail=5 horizon=24
2026-06-12T22:46:41.850643+00:00	20260612-224630-821553-482f93	3699fcf	-385.016521	discard	false	SOLUSDT	1h	2024-01-09T07:00:00+00:00	2026-02-23T19:00:00+00:00	-15.30	-0.19	46.46	67.80	70.90	144	dislocation_event_rolling_entry: dislocation-event-rolling-entry metric=basis_spread tail=5 horizon=24
2026-06-12T22:46:53.619833+00:00	20260612-224642-029278-26cf9b	3699fcf	-704.609833	discard	false	SOLUSDT	1h	2024-01-09T07:00:00+00:00	2026-02-23T19:00:00+00:00	-54.78	-1.50	78.59	99.20	67.13	195	dislocation_event_rolling_entry: dislocation-event-rolling-entry metric=premium_spread tail=10 horizon=24
2026-06-12T22:47:04.857655+00:00	20260612-224653-817308-692cf5	3699fcf	-586.677630	discard	false	SOLUSDT	1h	2024-01-09T07:00:00+00:00	2026-02-23T19:00:00+00:00	-38.46	-0.93	64.14	96.00	64.43	182	dislocation_event_rolling_entry: dislocation-event-rolling-entry metric=basis_spread tail=5 horizon=12
